,Review_Date,Author_Name,Vehicle_Title,Review_Title,Review,Rating
215, on 10/24/04 00:00 AM (PDT),sneaden ,2004 HUMMER H1 SUV Open Top 4WD 4dr SUV (6.5L 8cyl Turbodiesel 4A),AWESOME," The Hummer H1 is one of the beefiest and most amzing cars that i have ever driven. it doesnt ride or drive like a corvette but my guess is that if you made a 'vette that big it would drive or ride as nice as the H1. i love mine and when i get a new car it is going to be another one. they are big, bold, and always get you noticed when you pull up. a while back i accidentally pulled out of my drive too quick and ran flat over my brick mailbox, to my utter shock the only damage to my car was the tag was bent. the paint didnt chip, the bumper didnt bend... NOTHING!!! what was left ot my mailbox was dust and more dust.",5
216, on 06/06/04 00:00 AM (PDT),HazardMaster ,2004 HUMMER H1 SUV Open Top 4WD 4dr SUV (6.5L 8cyl Turbodiesel 4A),My review, its power is great,5
217, on 06/02/04 00:00 AM (PDT),havenblue ,2004 HUMMER H1 SUV Wagon 4WD 4dr SUV (6.5L 8cyl Turbodiesel 4A),Hummer, Very fun to drive - will go almost any where. Got it stuck the first week I owned it but a great winch,4.875
218, on 05/07/04 00:00 AM (PDT),Nanu Nanu ,2004 HUMMER H1 SUV Wagon 4WD 4dr SUV (6.5L 8cyl Turbodiesel 4A),The Hummer, The Hummer is the best SUV to drive they are easy to handle and great off-road. The interior and exterior are great. The overall value to me on the Hummer is awsome.,4.875
219, on 04/27/04 00:00 AM (PDT),akdriver ,2004 HUMMER H1 SUV Open Top 4WD 4dr SUV (6.5L 8cyl Turbodiesel 4A),driver," fun to drive, goes about anywhere andfuel consumption is amazing for avehicle of this weight and power",4.75
220, on 04/14/04 00:00 AM (PDT),Cristea ,2004 HUMMER H1 SUV Wagon 4WD 4dr SUV (6.5L 8cyl Turbodiesel 4A),Like no other SUV," If you want to help your friemds and neighbors out of ditches in the winter, this is the vehicle for you. The most legendary vehicle on the face of the earth. The only vehicle that everybody recognizes. Hand assembled in the USA - the ""American Royce Royce"" of SUV's.",4.75
221, on 04/13/04 00:00 AM (PDT),FANATIC ,2004 HUMMER H1 SUV Open Top 4WD 4dr SUV (6.5L 8cyl Turbodiesel 4A),GOOD HUMMER," The Hummer is an awesome car, it is kidsafe, and reliable. Though I've only hadit for a month I feel I can drive itanywhere without worrying about itbreaking down. And I feel good enoughabout this car to write this afterhaving it for only a month.",5
222, on 03/14/04 00:00 AM (PST),jake simmons ,2004 HUMMER H1 SUV Open Top 4WD 4dr SUV (6.5L 8cyl Turbodiesel 4A),good, i think it is great,5
223, on 03/10/04 00:00 AM (PST),Condalini ,2004 HUMMER H1 SUV Wagon 4WD 4dr SUV (6.5L 8cyl Turbodiesel 4A),Big Time!," the hummer h1 is a vehicle i purchasedfor one purpose only......because icould! its BIG but actually smaller thanthe h2. but its rough, tough,intimidating, and that along with theprice tag are the only reasons forbuying this. fuel economy is terrible,comfort? what's that?? steering wheel ischeap looking along with the interiormaterials. its the WORST best SUV on theroad hahahaha!!!",2.75
224, on 02/29/04 00:00 AM (PST),Romanpower ,2004 HUMMER H1 SUV Wagon 4WD 4dr SUV (6.5L 8cyl Turbodiesel 4A),Love this monster," Not for everyone, only for those who willing to have fun! This is my 2nd one, I love it now as I loved the day I bought it! The most experienced sales person reference the H! is Silvia Hare, Huntington Beach Hummer, ask her questions, she know all about the product.",4.75
225, on 02/18/04 00:00 AM (PST),ljafta333 ,2004 HUMMER H1 SUV Wagon 4WD 4dr SUV (6.5L 8cyl Turbodiesel 4A),good," well manufactured, heaven say's it all",4.875
226, on 02/17/04 00:00 AM (PST),PIT ,2004 HUMMER H1 SUV Wagon 4WD 4dr SUV (6.5L 8cyl Turbodiesel 4A),This is the best SUV ever made, This car has everything,5
227, on 12/30/03 00:00 AM (PST),Dide ,2004 HUMMER H1 SUV Open Top 4WD 4dr SUV (6.5L 8cyl Turbodiesel 4A),Nice, Awesome Vehicle to drive.,4.75
228, on 12/10/03 00:00 AM (PST),Ulysses ,2004 HUMMER H1 SUV Open Top 4WD 4dr SUV (6.5L 8cyl Turbodiesel 4A),This vehicle beats anything, This vehicle is absolutely the best thing anyone could ever experience either driving or riding in.  It's smooth and very intimidating on the road.  The off-road capabilities are are amazing.  You could tow a Range Rover or Land Rover out of it's stuck possition on the trail.,5
229, on 11/19/03 00:00 AM (PST),Phillip Acero ,2004 HUMMER H1 SUV Open Top 4WD 4dr SUV (6.5L 8cyl Turbodiesel 4A),G-Unit, Are you kidding.  This SUV is the best ever made.  It is very tough and reliable!!,4.75
230, on 10/18/06 13:53 PM (PDT),elvis corporal ,2002 HUMMER H1 SUV Open Top 4WD 4dr SUV (6.5L 8cyl Turbodiesel 4A),tuff momma, i'm a former military member and i always wanted to own one. the h1 is a great improvement from the military version as far as convenience. it rides great and i dont even use my drive way now i use my ditch. it turns lots of head and i loved it.,4.875
231, on 10/29/03 00:00 AM (PST),discostu004 ,2002 HUMMER H1 SUV Wagon 4WD 4dr SUV (6.5L 8cyl Turbodiesel 4A),Hummer H1," I just got this and it's pretty cool to drive.  i get the ""5'11"" blonde in a bikini"" stare from a lot of people.  if you have the opportunity, get one, if only for a little bit.  It's worth it!",4.25
232, on 10/23/03 00:00 AM (PDT),mike ewing ,2002 HUMMER H1 SUV 10th Anniv. Edition Wagon 4WD 4dr SUV (6.5L 8cyl Turbodiesel 4A),hummer, My hummer is a truely amazing hummer and cant be made any better,4.75
233, on 01/31/03 00:00 AM (PST),TUFENUFTIMM ,2002 HUMMER H1 SUV Open Top 4WD 4dr SUV (6.5L 8cyl Turbodiesel 4A),Awesome!,"   No concrete cowboy this one! Much more civilized on the street than you would expect,and even gnarlier off road than you could imagine. Acceptable power on the street and more than you really need off road. You don't need to ""take a run"" at everything,you point it and drive it smoothly,it WILL do the job. This is my 4th 4wd, and unmodified it will do more than any of the other modified ones. I've noticed that other 4wd'rs are envious to the point of hate, everyone else loves it!",4.375
234, on 01/20/03 00:00 AM (PST),jon12 ,2002 HUMMER H1 SUV 10th Anniv. Edition Wagon 4WD 4dr SUV (6.5L 8cyl Turbodiesel 4A),great, just a great truck,5
235, on 08/02/02 00:00 AM (PDT),James Schultz ,2002 HUMMER H1 SUV Open Top 4WD 4dr SUV (6.5L 8cyl Turbodiesel 4A),Hooaah," A wonderful buy, you can't get anything better then this if your looking for off roading. Price is iffy though. I compares relitivly nicly to the military style hmmwvs",4.75
236, on 06/12/02 00:00 AM (PDT),georde ,2002 HUMMER H1 SUV 10th Anniv. Edition Wagon 4WD 4dr SUV (6.5L 8cyl Turbodiesel 4A),horse," fun to drive, causes many stares",4.125
237, on 05/24/02 00:00 AM (PDT),Rhino19625 ,2002 HUMMER H1 SUV Open Top 4WD 4dr SUV (6.5L 8cyl Turbodiesel 4A),Love at First Drive," This is perfect for Off-roading through sand, mud and shallow water.  It is comfortable, fun to drive and relaxing.",5
238, on 04/29/02 00:00 AM (PDT),Harry Manback ,2002 HUMMER H1 SUV Wagon 4WD 4dr SUV (6.5L 8cyl Turbodiesel 4A),hummers are great, Absolutely the best ATV on the planet.  It has a ton of torque it is the greatest human made machine on the planet.,5
239, on 04/25/02 00:00 AM (PDT),o ,2002 HUMMER H1 SUV Wagon 4WD 4dr SUV (6.5L 8cyl Turbodiesel 4A),good car, excellent car for anyone who loves going off-road.Also good for people that want a safe car,5
240, on 03/28/02 00:00 AM (PST),Tom Waltz ,2002 HUMMER H1 SUV Wagon 4WD 4dr SUV (6.5L 8cyl Turbodiesel 4A),Best On Earth," The best SUV on the planet.  If you can't handle it, don't knock it.",4.625
241, on 05/21/04 00:00 AM (PDT),Jawad ,2001 HUMMER H1 SUV Open Top 4WD 4dr SUV (6.5L 8cyl Turbodiesel 4A),Beast from the Middle East," Great vehicle. If you rate less than a 10, then you don't understand the capabilities of this truck",5
242, on 12/13/03 00:00 AM (PST),santocrail ,2001 HUMMER H1 SUV Open Top 4WD 4dr SUV (6.5L 8cyl Turbodiesel 4A),A-OK," A-OK 9000 miles now, no problemos.",4.875
243, on 04/19/02 00:00 AM (PDT),Craig Barnes ,2001 HUMMER H1 SUV Hard Top 4WD 2dr SUV (6.5L 8cyl Turbodiesel 4A),Hummer," Nice Car, but a little too big with not much interior space.",4.25
244, on 11/05/03 00:00 AM (PST),OR Romeo ,2003 HUMMER H1 SUV Open Top 4WD 4dr SUV (6.5L 8cyl Turbodiesel 4A),Hummer,"  The H1 Hummer is a vehicle which will go just about anywhere. The best part about this vehicle is that it has independent suspension on all four wheels, unlike the H2 hummer which has only front independent suspesion and it has a solid rear axle.  This is what makes H2 so different from the H1 hummer. ",4.5
245, on 10/25/03 00:00 AM (PDT),lucasmikey ,2003 HUMMER H1 SUV Open Top 4WD 4dr SUV (6.5L 8cyl Turbodiesel 4A),nice, this cars hot!i would buy two if i could afford it!thank god for hummers!,5
246, on 10/17/03 00:00 AM (PDT),Buzogima ,2003 HUMMER H1 SUV Open Top 4WD 4dr SUV (6.5L 8cyl Turbodiesel 4A),H1 Thunder," The Hummer H1 is an awsome machine with great capabilities.  Personally I think its the best vehicle on the market despite the high price tag.  I instlled an eightinch lift and a set of custom  60inch super swampers, a blower, nitrous, a new exhaust, and propane in mine it does about 150 tops with 800 horsepower and 0-60 in 4x4 in 4.4 seconds.",5
247, on 10/10/03 00:00 AM (PDT),mbag ,2003 HUMMER H1 SUV Wagon 4WD 4dr SUV (6.5L 8cyl Turbodiesel 4A),2002 h1," great truck! Perfect for hauling my large dogs around, they love it. My wife and I have a great time off road and I use it as my main transportation.",4.625
248, on 09/25/03 00:00 AM (PDT),Kevin9545ATL ,2003 HUMMER H1 SUV Wagon 4WD 4dr SUV (6.5L 8cyl Turbodiesel 4A),H1, This SUV is great. It is an attention getter. You can pick up girls anytime with this car. I only drive mine to the club or to the beach. This was worth every penny I spent in Law School. ,4.625
249, on 09/11/03 00:00 AM (PDT),djw ,2003 HUMMER H1 SUV Open Top 4WD 4dr SUV (6.5L 8cyl Turbodiesel 4A),The best vehicle in the entire world., They should have used a hummer on the moon instead of that peice they did.,5
250, on 09/03/03 00:00 AM (PDT),DONALD ,2003 HUMMER H1 SUV Open Top 4WD 4dr SUV (6.5L 8cyl Turbodiesel 4A),AWESOME HUMMERS, HUMMERS ARE GREAT VEHICLES TO HAVE. THE ONLY THING ID CHANGE IS THE PRICE BECAUSE THEIR A LITTLE EXPENSIVE,5
251, on 08/05/03 00:00 AM (PDT),lis ,2003 HUMMER H1 SUV Open Top 4WD 4dr SUV (6.5L 8cyl Turbodiesel 4A),fun fun fun," We have had the vehicle only a few weeks,but we have been having a great time.I would not like to drive very long distances,but for short to medium,its great fun,and the build quality seems fine,and it has plenty of cabin space.We have H2 not H1",4.625
252, on 07/30/03 00:00 AM (PDT),paige miller ,2003 HUMMER H1 SUV Open Top 4WD 4dr SUV (6.5L 8cyl Turbodiesel 4A),paige, this vehicle is probably the best car u would want if u like to take your dogs to the beach so  you can drive trough water.,4.625
253, on 07/08/03 00:00 AM (PDT),HummerGuy ,2003 HUMMER H1 SUV Wagon 4WD 4dr SUV (6.5L 8cyl Turbodiesel 4A),Great," This vehcle is the best. Really fun to drive and great reliability. This vehicle can go anywhere. If you want fake alloy trim and and a mushy interior buy the H2, but if you want the original, real, qualtity Hummer buy the H1. H for hummer and 1 for one and only. If you can afford this car, then you can afford the gas for it. This vehicle is exotic and solid. Goes over virtually any obstacle. Also, you get lots of attention and almost no one has this vehicle. I luv it, I luv it, I luv it.",4.375
254, on 06/18/03 00:00 AM (PDT),deathstrike ,2003 HUMMER H1 SUV Open Top 4WD 4dr SUV (6.5L 8cyl Turbodiesel 4A),this rules the world, This car is the best ever. Ive droven vipers and corvettes but hummers are the best.,5
255, on 06/10/03 00:00 AM (PDT),Luke Dampf ,2003 HUMMER H1 SUV Open Top 4WD 4dr SUV (6.5L 8cyl Turbodiesel 4A),Hummer H1 survey," Hummer H1's best ogg-road truck I ever see, when I drove Hummer H1, it feel so great, Also very powerful engine, high torque,  Flat tire system, bulletproof windows, a lots more, H1's a LOTS better than H2, I believe that H2 is for a road style SUV, not off road, Ugly body style, etc. H1 rules off road world!",5
256, on 05/07/03 00:00 AM (PDT),Dana Terry ,2003 HUMMER H1 SUV Wagon 4WD 4dr SUV (6.5L 8cyl Turbodiesel 4A),Nothing can match this Big Rig," After purchasing my H1 I decided to join to local So. CA Hummer Group and we have gone up 60% slopes where all you can see is sky out of your window. This rig can go over anything in its way with ease. Fuel economy?  13 miles to gallon (diesel) which is not bad for a 7300 lb dirtbike. The market is not saturated with these vehicles so you get all the looks and admiartion. est vehicle I have ever owned. If you want absolute comfort and fuel economy by a cadillac, but if you want a real machine... get the H1!",4.625
257, on 05/03/03 00:00 AM (PDT),michael wolf ,2003 HUMMER H1 SUV Wagon 4WD 4dr SUV (6.5L 8cyl Turbodiesel 4A),wow," awesome! this is the best car in the world. It is so big and fancy.It drives perfectly, too.",5
258, on 03/03/03 00:00 AM (PST),littleredvette21 ,2003 HUMMER H1 SUV Wagon 4WD 4dr SUV (6.5L 8cyl Turbodiesel 4A),The H1," Driving The H1 is like they say "" Like nothing else. I realy enjoy my time. I make up fake place's I "" have to go to"" just to drive it . The is the best truck I've ever driven. The only con about it is the milage. One other thing I like about it is that ablity to go any were!",4.875
259, on 03/02/03 00:00 AM (PST),.Erik. ,2003 HUMMER H1 SUV Wagon 4WD 4dr SUV (6.5L 8cyl Turbodiesel 4A),best Suv ever," The hummer is probably the best Suv we ever driven, its insane at off-roading and has a lot of cool features. It is huge and has alot of power and grunt. It is very relible and roomy.",4.75
260, on 02/12/03 00:00 AM (PST),JOSHUA ,2003 HUMMER H1 SUV Wagon 4WD 4dr SUV (6.5L 8cyl Turbodiesel 4A),MY HUMMER H1," IT IS AMAZING TO DRIVE OFF-ROAD AND THAT`S WHAT IT`S FOR.IT NOT GREAT ON ROAD, BUT IT`S VERY RELIABLE AND YOU GET STARES WHERE EVER  YOU GO IN IT",5
261, on 02/07/03 00:00 AM (PST),ChrisH ,2003 HUMMER H1 SUV Open Top 4WD 4dr SUV (6.5L 8cyl Turbodiesel 4A),Waited 10 Years was it worth it., Love it.  Can't say enough good things about it.  I could have been a sell out and bought an H2 for the same price but why.  The H1 is more comfortable.,5
262, on 02/07/03 00:00 AM (PST), ,2003 HUMMER H1 SUV Open Top 4WD 4dr SUV (6.5L 8cyl Turbodiesel 4A),Waited 10 Years was it worth it., Love it.  Can't say enough good things about it.  I could have been a sell out and bought an H2 for the same price but why.  The H1 is more comfortable.,5
263, on 12/29/02 00:00 AM (PST),carguy0007 ,2003 HUMMER H1 SUV Wagon 4WD 4dr SUV (6.5L 8cyl Turbodiesel 4A),Hummer:Test 1,"  It was an experience like no other driving one of America's most bold suv's, due to the rugged looks, superman power, and it's outstanding craftsmanship. It's truly one heck of an suv.",4.75
264, on 12/24/02 00:00 AM (PST),John McCance ,2003 HUMMER H1 SUV Wagon 4WD 4dr SUV (6.5L 8cyl Turbodiesel 4A),$$$Pricey$$$, Hummer hasn't really done much with the H1 for the past few years. I love the exterior design and there is no competiton when it comes to off-roading. I think that the people at GM haven't really thought more on the lines of the H2 interior because the H1's is PLAIN!,3.625
265, on 11/22/02 00:00 AM (PST),kvn ,2003 HUMMER H1 SUV Open Top 4WD 4dr SUV (6.5L 8cyl Turbodiesel 4A),perfect but gas, I have no complaints about this vechile except for the gas uage.,4.25
266, on 02/28/18 20:33 PM (PST),Blayke ,2006 HUMMER H2 SUV 4dr SUV 4WD (6.0L 8cyl 4A),Hummer h2, 1 of the best suv' s i have ever bought,5
267, on 04/09/13 10:12 AM (PDT),inyerhed68 ,2006 HUMMER H2 SUV 4dr SUV 4WD (6.0L 8cyl 4A),H2 is King of the Asphalt and off road!, By far the very best vehicle I have ever owned! It's a criminal thing that these beautiful machines are no longer in production. Fits All 3 of my children in the middle bench seat with ease and they love it! good sized cargo area and even more if your H2 is fitted with the spare on the outside-mine is. And removal of the single rear seat is easy out and easily put back in. My wife loves driving it as well. And.....I love to go fresh water fishing and the area I fish it not easily accessed as it has extremely soft sand and some hills to climb. No problem for my H2!....Neutral then change to low 4 in we go! Love this vehicle and it's an eye catcher! All black exterior and interior!,5
268, on 12/13/09 03:42 AM (PST),easysixonezero ,2006 HUMMER H2 SUV 4dr SUV 4WD (6.0L 8cyl 4A),Used low mile H2," Was looking for a vehicle for the family - wife and I and three kids from 10 yrs to 6 weeks old.  We pull an RV and I wanted  full-sized SUV. I knew MPG would not be fantastic regardless of the model.  With the H2 I have more capability than I will likely ever need, but emergencies do arise.  With the large size and weight I feel my family is very safe inside.  Ride has been MUCH better than I expected.  Very comfortable.  Don't know what vehicle the ""professional"" reviewer drove but this SUV has tons of room.  I can easily sit three adults across the back seat.  Check out pre-owned certified H2s still avail in the 20-30K miles for reasonable prices.  Same as or less than a similar Tahoe.",4.75
269, on 11/02/09 18:58 PM (PST),aldol ,2006 HUMMER H2 SUV 4dr SUV 4WD (6.0L 8cyl 4A),love my hummers ( i have 2 H2's)," I bought one (pewter metallic) intending to use it for a weapon development project, but as soon as I sat behind the wheel I fell in love with my h2,  my daughter, 27 at the time immediately wanted to trade in her Lexus suv for black h2. Since I bought them I kept accessorizing them. These cars are nothing short of amazing. ",4.625
270, on 12/15/08 22:44 PM (PST),linda peluso ,2006 HUMMER H2 SUV 4dr SUV 4WD (6.0L 8cyl 4A),Very Best SUV ever!," Best, safest, super great looking and most dynamic vehicle we have ever owned and will chose to own nothing but an H2. Aside from the fact that it is not a fuel efficient truck, this is a challenge most certainly, and that it is missing a rear view camera which should be a mandatory factory installation, this truck is a must see and drive and get to know! Thanks GM!",4.625
271, on 11/24/08 22:58 PM (PST),Clint Cord ,2006 HUMMER H2 SUV 4dr SUV 4WD (6.0L 8cyl 4A),There's nothing like it!," Having owned some very extravagant & exotic vehicles, there is nothing like a Hummer H2! I'm embarrassingly proud to own such a magnificent & unmistakable machine! I'd never even ridden in, let alone driven one before I bought online, sight unseen 2000 miles away - no disappointments! If you're looking and thinking about owning one - take the leap of faith and treat yourself!",4.375
272, on 07/22/08 18:58 PM (PDT),Tony Wes ,2006 HUMMER H2 SUV 4dr SUV 4WD (6.0L 8cyl 4A),The Holy Grail," I would never ride in or touch a Hummer until I could finally afford one. It's like the Stanley Cup. You don't touch it until you win it. That day came a few weeks ago for me and it has been incredible!  Love driving it, getting looks, surprisingly easy to park and so comfortable. I recently picked up my 60 something parents from the airport and they had no trouble getting in or out and thought it rode better than their own vehicles. I have always loved the look of the H2 and and now enjoying driving it every day. There is no comparison, it is the best.",4.75
273, on 05/10/08 20:46 PM (PDT),Rich ,2006 HUMMER H2 SUV 4dr SUV 4WD (6.0L 8cyl 4A),H2 When you absolutely have to get there," Having owned my 2006 H2 for over a year, I can safely say, that this is the best truck I have ever owned, if you think having a truck that performs better than intended off road, and in emergency situations is important. Also, ariving in style is not a problem! If you have to worry about gas, well then go buy that Festiva, for every day *(I have one! 43mpg) and you can average 27MPG!  Overall, I like the vehicle for what it stands for, and it's performance.",4.625
274, on 04/05/08 06:26 AM (PDT),Roger ,2006 HUMMER H2 SUV 4dr SUV 4WD (6.0L 8cyl 4A),Better than expected," I too have only recently purchased my one-owner Hummer H2. I admit I had some reservations concerning it's towing ability and gas mileage. But surprizingly I have average 14.5mpg (2807.2 gal used/40920 miles accrued =14.5mpg). This Hummer is also equipped with the dealer installed Radix Supercharger(63%-123% more power from 2k-6k rpm),base being 325hp, It doesn't require a mathematician to figure out that at 6k rpm it's capable of making nearly 600 HP! So power is plentiful. And the vehicle handles beautifully,alot better than the GMC 2500 I traded. And of course with this much power at a given whim, I needed the extended warranty. And off roading is a breeze,just watch your throttle position.",4.625
275, on 03/07/08 21:40 PM (PST),Terri ,2006 HUMMER H2 SUV 4dr SUV 4WD (6.0L 8cyl 4A),The Best SUV I've ever had," You are totally safe in this beast. That's the reason I bought it which to me outweighs the gas mileage. My kids love it too. Handles great and the visibility is excellent. Makes a tighter u-turn than some small cars. If you look underneath all you see is solid cast iron which I think they are changing in the newer models(for better gas mileage, too bad). And most of all it's fun to drive especially off road. My husband thought I was crazy to get the Hummer but he was surprized the way it handles. I think he's a little jealous now. I like having the tire in the back for added safety too. Oh by the way its fun to make your own parking space on those crowded occasions!",4.5
276, on 01/30/08 05:02 AM (PST),engineer ,2006 HUMMER H2 SUV 4dr SUV 4WD (6.0L 8cyl 4A),Well worth it, After buying a new H-3... I felt a bit slighted when I sat in a H-2. The search began for a late model used with warranty. I bought the H2 and it was love at first sight. Don't be foolish and buy new... you can buy a certified used for about 20K less and have the same warranty without the depreciation. I bought mine loaded with only 10K miles for $39K MSRP was $58K. Enough said. The drive and comfort can't be compared to any other vehicle. I get 13.5 MPG around town and was only getting 15 with MY H-3. The interior is very spacious however there is a lot of wasted space in the rear. The wind noise is loud at highway speeds and the low roof takes a bit of getting used too. ,4.375
277, on 06/07/07 08:50 AM (PDT),Ding ,2006 HUMMER H2 SUV 4dr SUV 4WD (6.0L 8cyl 4A),'06 H2 4D SUV Adventure," This H2 is the fifth addition to our fleet of family vehicles and has become my favorite daily driver ever since. I wanted to buy the H2 since it was introduced in '03 but I can't believe I waited that long to finally decide to buy one last January. I feel safe driving it around town and on the highways. I've driven it along rough roads inside our ranch and boy, how I love how it handles, rock solid. I average 12.5 miles on combination of city and hi-way driving and it is a lot better than the 9 mpg I get from my Ramcharger. I will not replace it with any other car except with another H2.",4.625
278, on 09/25/06 17:27 PM (PDT),mike ,2006 HUMMER H2 SUV 4dr SUV 4WD (6.0L 8cyl 4A),Beast!!," I have only owned this Hummer H2 for about a month and a half now but man is it great. I am only 20 years old and can hardly afford it but it is worth all the money. I have had so many people compliment me on it so i am very proud to say i am a HUMMER owner! This is a real 4x4, sometimes when i go to the store i will park one tire up on the curb just to let people know what it can do. So if you are in the market for a new vehicle dont make any excuses just get it!!",4.375
279, on 06/01/06 15:00 PM (PDT),qtlapi ,2006 HUMMER H2 SUV 4dr SUV 4WD (6.0L 8cyl 4A),H2 Not for me, I had my H2 for 7 monthsafter having owned a Mercedes E350. The H2 was nowhere near comparable. The acceleration was just not there. Parking in garages was imposible and try getting in with high heel shoes. The gas mileage and the interior were very poor. The H2 was an attention getter some was positive and some was poor especially after Hurricane Wilma when there was a shortage of gas in town. I now have a BMW 650 and Im  much happier. This is just an overpowering kind  of an suv.,2.5
280, on 05/08/06 20:50 PM (PDT),Terry ,2006 HUMMER H2 SUV 4dr SUV 4WD (6.0L 8cyl 4A),Very Satisfied," I love driving my H2 Hummer, there's no other car like it!!  The day we picked up the Hummer from the dealer, I sat in the passenger seat and fell asleep, which I rarely do. It was that comfortable.  I'm seeing more and more ladies drive a Hummer.  And to think, I was looking at the Lexus SUV, I would have been sorry.",4.75
281, on 04/02/06 19:09 PM (PDT),Green Rider ,2006 HUMMER H2 SUV 4dr SUV 4WD (6.0L 8cyl 4A),Really enjoying the H2," I am a recent H2 owner, after years of mostly sports cars...  I've never had a vehicle that was anywhere near as enjoyable as the H2.  People really seem to respond to a ride in the big truck, everybody wants you to drive, and everybody wants to ride around.  Its comfortable, its cool, it feels safe & snug for such a big beast.    Does the H2 get good mileage?  no.  is it 1-2 MPG around town better than my 3/4 ton silverado?  yes.  And easier to park.  The ride is more luxury SUV than pickup, and the experience of riding around in the humm has no match.  I had considered the possibility of getting alot of negative attention, but so far people just loooove this thing.   Drive politely!",4.625
