,Review_Date,Author_Name,Vehicle_Title,Review_Title,Review,Rating
401, on 12/15/05 13:08 PM (PST),MACCKS ,2005 HUMMER H2 SUV 4WD 4dr SUV (6.0L 8cyl 4A),H2 -  Safety Design," My husband recently hit a tree and totalled our $71,000 05 H2.  How do you total a HUMMER? The H2 front end impact design shifted the ""energy"" absorbed by the accident under the vehicle instead of into the passenger seating area.  Thus, damaging the frame, transfer case, rear end housing, etc. He walked away with only a seatbelt bruise.  We are convinced this vehicle saved his life and can't wait to buy another!",5
402, on 12/01/05 18:13 PM (PST),H2 ,2005 HUMMER H2 SUV 4WD 4dr SUV (6.0L 8cyl 4A),DJA," This is the second one we have owned. We have a large piece of property with some horrible roads. My wife loves the vehicle and wouldn't want anything else. It is very durable and I feel safer with her in it. It does get horrible mileage and is as aerodynamic as a box which makes it hard to keep the wind shield clean. Other than the mileage, we are thrilled with the vehicle and the way it handles.",4.375
403, on 11/08/05 15:45 PM (PST),mjleblanc ,2005 HUMMER H2 SUV 4WD 4dr SUV (6.0L 8cyl 4A),Humming along," Perhaps the best SUV I have ever owned, can really go just about anywhere. Maintenance and repairs are costly, given the thievery rampant in the dealer/manufacturer scheme of hourly bilking. Gas mileage is the same as my Suburban. Love the car!",4.75
404, on 11/07/05 08:11 AM (PST),CPO TOYS ,2005 HUMMER H2 SUV 4WD 4dr SUV (6.0L 8cyl 4A),Gotta have one," What an awesome vehicle.  This is my 2nd H2.  The power is great, the ride is comfortable even on the long drives.  The only item I wish the 2005 model would come with is adjustable pedals.  You can buy after market exhaust, airfilter and a chip to boost the HP, but hold on to your hat, it will move.  People who complain about gas mileage, shouldn't own one then.  I average 11-12 per gallon.",4.875
405, on 11/05/05 23:50 PM (PST),Dayna ,2005 HUMMER H2 SUV 4WD 4dr SUV (6.0L 8cyl 4A),Best SUV Ever - Can't ask for much more!," My husband and I bought this car a year ago right before we found out I was pregnant.  This car is great for hauling a child around, plenty of room for a stroller, the DVD's that the H2 has as an upgrade is going to come in handing in a couple months and it feels safe when you drive.  I have no complaints.  Great family automobile.",4.5
406, on 10/04/05 18:35 PM (PDT),hummermom ,2005 HUMMER H2 SUV 4WD 4dr SUV (6.0L 8cyl 4A),Big Safe Children Transporter," I have 4 sons (6,10,12,14), Needless to say we carry lots of STUFF .... baseball, band equipment and lots of friends.  The gas mileage leaves something to be desired but for the type of driving I do (short trips) It's really not that painful.  I fill up about every two weeks.  I love my H2 and it makes me feel very safe carrying my precious cargo!",4.625
407, on 09/03/05 15:09 PM (PDT),Samuel ,2005 HUMMER H2 SUV 4WD 4dr SUV (6.0L 8cyl 4A),Great Car and Fun = HUMMER," I just bought this car a few months ago, and believe me it is for real like nothing else. It is a car that it will take you anywhere, from a dinner in a fine restaurant to the mountains. The perfect partner for any adventure.",4.875
408, on 08/16/05 12:26 PM (PDT),H2 ,2005 HUMMER H2 SUV 4WD 4dr SUV (6.0L 8cyl 4A),Mudding," I like the feel of secureness.  Being able to go over and trhough things with no problem.  I enjoy going mudding.  It handles so well.  Very comfortable to travel in.   I have put over 20,000 miles in less than 6 months.  Its worth it",4.375
409, on 08/09/05 18:04 PM (PDT),Jeff Hasbrouck ,2005 HUMMER H2 SUV 4WD 4dr SUV (6.0L 8cyl 4A),Hummer H2," Great to drive. Awesome turn radius.  Smooth suspension (equipped with air suspension), full time 4X4 and a very comfortable and roomy interior.  Very happy with my purchase.",4.75
410, on 07/26/05 20:24 PM (PDT),Boxster-S ,2005 HUMMER H2 SUV 4WD 4dr SUV (6.0L 8cyl 4A),$11K rebate ," With that GM Employee Discount we could not pass up this vehicle.  We intended to consider the H3 but had the good fortune of also driving the H2.  Entirely different vehicle!  As much as I liked the H2 my wife and two sons absolutely love it.  It continues to grow on me.  We cannot wait to take it off roading, towing our Ricon and then there is the snow that is dumped on us here. :)",5
411, on 07/19/05 20:00 PM (PDT),Truman ,2005 HUMMER H2 SUV 4WD 4dr SUV (6.0L 8cyl 4A),Love it!," I've never had an off-road (or any other) SUV, and the H2 drives like the best car I've ever owned! I'm only getting 10-13 mpg, so I would like to know how others are getting up to 20. Of course, I also love the attention everywhere I drive, too.",4.625
412, on 07/14/05 12:29 PM (PDT),Donna ,2005 HUMMER H2 SUV 4WD 4dr SUV (6.0L 8cyl 4A),Love It!, I love this vehicle and so do my childern. I feel safe and the interior of the vehicle is very comfortable and the ride is also.  GM makes a great auto,4.5
413, on 07/07/05 17:54 PM (PDT),Craig ,2005 HUMMER H2 SUV 4WD 4dr SUV (6.0L 8cyl 4A),The better choice," Smooth ride accelerates quickly with a high rev, but once you get going it's all comfort. Great steering and with a rear cam good visibility. Get the lux package you'll be happy you did. The tires are great don't bother changing them out. Interior design is great, soft leather and a wide sunroof works. Be careful driving it home the roof clearence is something to get used to. Remeber to keep the sunroof open and pay attention to the garage door height. Remeber that DVD's in the headrests keep children quiet!",4.75
414, on 06/20/05 18:00 PM (PDT),orsunbear ,2005 HUMMER H2 SUV 4WD 4dr SUV (6.0L 8cyl 4A),Best Vehicle I have ever owned!," I've owned a great number of cars and trucks over the years, but this one beats them all hands down. First of all is the interior room. I am a 6'5"" driver and I swear I could wear a cowboy hat while driving! I have put 45,000 miles on my H2 in two years. Driving from Oregon to Las Vegas and back between homes several times a year, I can drive straight through and still arrive in comfort. Other than changing the oil (synthetic for me!!) I have never touched this vehicle or had  problems. I'll be driving an H2 as long as they keep building them. If they stop, I'd go buy two or three tomorrow just to insure I have one for life!!!",4.875
415, on 06/19/05 11:50 AM (PDT),Terry ,2005 HUMMER H2 SUV 4WD 4dr SUV (6.0L 8cyl 4A),excellent truck, best built gm product ever had. drives like a small car and has guts and style. no rattles or weird noises or any service issues after 10000 miles (so far),4.75
416, on 06/13/05 18:00 PM (PDT),Richard ,2005 HUMMER H2 SUV 4WD 4dr SUV (6.0L 8cyl 4A),I'd buy another one.," Those who criticize the H2 have obviously never taken one down the highway - or off road.  Pay no attention to criticism this vehicle has received from those who haven't taken the time to fully understand its powers. There is nothing on the market that compares.  Having owned 30 cars in 25 years - I'll tell you simply .. this is the best .. hands down. It has incredible highway skills, is fearless off road or through a blizzard and is elegant driving down Sunset Blvd.  Inside the H2 with the windows up and XM Radio off, you'll never even know the engine is running. My H2 secret!  Drive at 60 on the highway and you'll get 21 miles to the gallon!!  My wife was stunned. She now want an H3.",4.375
417, on 05/29/05 09:21 AM (PDT),Courtney ,2005 HUMMER H2 SUV 4WD 4dr SUV (6.0L 8cyl 4A),Not just for looks!!," I drive mine to/from work everyday and love the safe feeling of being surrounded by 6900 lbs of quality vehicle.  I have had my H2 off roading in the high desert of California and it did great!!    I have also been through some very hair-raising situations and ""she"" performed beautifully, the anti-lock brakes worked great on uneven, wet pavement and the stearing didn't diminish at all.  The H2 is a status vehicle that I am proud to drive anywhere!!",4.625
418, on 05/24/05 16:04 PM (PDT),Stormin Norm ,2005 HUMMER H2 SUV 4WD 4dr SUV (6.0L 8cyl 4A),Hummer Forever," Consider what the h2 is for, and it's not commuting!  Is it slower than a mustang and suck enough gas for 3 honda civics?  You bet.  But on the fun index, it ranks off the charts!  Participated in a off-road excursion with Hummer group for first time and was awestruck by the vehicles abilities!  Nothing else can touch this.  Takes you to places and scenery you would never otherwise be able to see.  Without this off-roading experience, you can't possibly appreciate what this vehicle can do.  Even after traversing some of the roughest terrain imaginable, the truck is completely silent and squeak free.  Remember to consider what this truck is designed for. Good as a daily driver except for gas.",4.75
419, on 05/18/05 18:22 PM (PDT),CAMPMAN ,2005 HUMMER H2 SUV 4WD 4dr SUV (6.0L 8cyl 4A),STRONG," Though the fuel consumption could be a lot better, and some of the interior components are a little weak (housing around the shifter, for example, feels lightweight); overall the H2 is a great vehicle. Comfortable, safe, and very capable of either highway cruising or driving off-road. Overall, the experience so far (3 months later) has been a great one.",4.5
420, on 05/17/05 22:43 PM (PDT),FOOTFXR52 ,2005 HUMMER H2 SUV 4WD 4dr SUV (6.0L 8cyl 4A),H2," I have had everything from mercedes to porsches to tahoes and 3/4 ton diesel suburbans and i never regret trading my sl 500 for this '05 h2. I have had it off road and it is extremely capable even in the hands of rookie off roaders as we had at our last dealer sponsored get together in a cypress swamp after 3 day's rain. The dealer service has been exceptional. And my wife recently asked to take it from florida to n. Carolina to mississippi back to n. Carolina and back to ocala, fl. The kicker? She chose it over her mercedes ml 55 amg!!",4.75
421, on 05/16/05 17:05 PM (PDT),Artie ,2005 HUMMER H2 SUV 4WD 4dr SUV (6.0L 8cyl 4A),Enjoy Your Short Stay!!!," I have to tell you this truck is a joy compared to my 1994 H1. I traded my H1 for the 2004 Infinity QX56 and the roads here in New England were destroying this truck. My Qx56 felt like the suspension a 10 year old truck after one New England winter. I was seeing 10mpg for the Qx56 and 9 mpg for the H1. My new H2 averages 11mpg city and as high as 18 on highway at 60mpg. This truck really is fun to drive. The touch screen nav,large sunroof,Xm radio,heated seats,power mirrors really make this truck a pleasure to drive. For a guy who really has owned most cars and trucks out there, this H2 is my favorite. I traded my Mercedes SL600 sport for it!!! Life is too short.....enjoy!!! ",4.75
422, on 05/13/05 14:48 PM (PDT),mari ,2005 HUMMER H2 SUV 4WD 4dr SUV (6.0L 8cyl 4A),H2, I love my H2.  My mileage was about the same as other large SUV's (approx. 12 miles per gallon). The vehicle handles very well and drives smoothly. The only negative is on the 2004 model the spare tire is on the inside and takes away space. (2005 models come with the spare on the outside),4.25
423, on 05/04/05 15:55 PM (PDT),GYNGUY ,2005 HUMMER H2 SUV 4WD 4dr SUV (6.0L 8cyl 4A),Hummerlicious2, This truck has been fantastic! The pwer and quality are fantastic! Gas milage is better then  reported! I'm getting 13.5 Miles to the gal. City driving. All in all i'm very happy with this purchase!,5
424, on 05/01/05 12:52 PM (PDT),fxracer223 ,2005 HUMMER H2 SUV 4WD 4dr SUV (6.0L 8cyl 4A),My HUMMER, My purchase of my HUMMER H2 was the best vehclie i have ever bought because of the stylist exterior and interior.This was the only vehcile that i had that people would actaully stop to look at and the handling and preformance is just excellent.    ,5
425, on 04/30/05 07:59 AM (PDT),Lenny ,2005 HUMMER H2 SUV 4WD 4dr SUV (6.0L 8cyl 4A),H2 Hummer," The truck is better than I expected. The fuel milage is a small drawback price to pay, for driving this machine. ",4.875
426, on 04/27/05 23:11 PM (PDT),hummer h2 ,2005 HUMMER H2 SUV 4WD 4dr SUV (6.0L 8cyl 4A),Nothing else like it.,  My H2 is fun to drive. Fuel is obviously a killer--but I can't believe that I would ever get tired of driving my H2. It's a unique vehicle. ,4.75
427, on 04/24/05 21:00 PM (PDT),hummer2005 ,2005 HUMMER H2 SUV 4WD 4dr SUV (6.0L 8cyl 4A),hummer , Its a great truck to own. It is worth the gas to have and enjoy.,4.875
428, on 04/13/05 17:57 PM (PDT),Ron Elfgen ,2005 HUMMER H2 SUV 4WD 4dr SUV (6.0L 8cyl 4A),Best Automobile I have ever owned!!!," I have owned my H-2 for over one year now. I have traveled over 26,000 miles both on highway, streets and off road. The gas mileage isn't the best but I do seem to get about 15 mpg on the highway and get about 11 mpg in town which was the same as my old F-150. I have also traveled from florida to Alaska where I am working now. The trip was very plesant due to my H-2s ride and comfort.",4.75
429, on 04/11/05 17:23 PM (PDT),Trevor  ,2005 HUMMER H2 SUV 4WD 4dr SUV (6.0L 8cyl 4A),use it ," its a  fun head truner that easy to make different form the other on the road. H2 are not the fast but that not what you get it for, its great off road and if you get one you should use it so you can respect what its about. but at the same time its comfort level is there with any other SUV. ",4.5
430, on 03/31/05 16:35 PM (PST),raysnper ,2005 HUMMER H2 SUV 4WD 4dr SUV (6.0L 8cyl 4A),"SSS,Inc. ", The power and performance of the 2005 LUX H2 was a pleasant surprise.  The ride and comfort is something you would expect from a luxury sedan.,4.625
431, on 03/27/05 09:19 AM (PST),Scarboy ,2005 HUMMER H2 SUV 4WD 4dr SUV (6.0L 8cyl 4A),Boxy But Sexy," Overall this vehicle has met my expectations. Negatives-- It could use more front seat leg room and it would be nice if the 2nd row seats reclined. Interior jack location could have been thought out better. Windshield leaked from poor installation at factory and both front seat height adjustment switches have gone out.    Positives--This vehicle will perform as advertised. It handles/performs like a sports car and almost nothing short of water submersion will stop it. If you have to get the ""heck out of dodge"" this is the vehicle. Just fill up the tank at every opportunity. Would definitely buy again.",4.125
432, on 03/25/05 16:54 PM (PST),H2 ,2005 HUMMER H2 SUV 4WD 4dr SUV (6.0L 8cyl 4A),Best Truck I've Owned," This SUV is roomy and well laid out on the inside, it drives like a small car with the smooth luxury ride, surprisingly easy to handle, and its a head turner wherever you go",4.75
433, on 03/23/05 21:15 PM (PST),Big Gurl ,2005 HUMMER H2 SUV 4WD 4dr SUV (6.0L 8cyl 4A),Abby's review, I am really enjoying my H2 - I have a 2005 and the color is stealth gray. I enjoy the comfort and the stares as well! Anyone purchasing this vehicle must know that it's a gas guzzler so don't go in blindly. The fun outweights it. I use mine as an everyday vehicle. It runs just fine!,4.125
434, on 03/23/05 19:21 PM (PST),I LIKE IT ,2005 HUMMER H2 SUV 4WD 4dr SUV (6.0L 8cyl 4A),NICE RIDE," Fun to drive, fuel economy 12.5 to 13.5; they improved it in 2005 to this. We enjoy it fully and glad we purchased it",4.625
435, on 03/15/05 13:39 PM (PST),Tyler ,2005 HUMMER H2 SUV 4WD 4dr SUV (6.0L 8cyl 4A),Hummer Rocks, The H2 Hummer is an awesome vehicle.  Its off-road capability is unmatched and the highway ride is incredibly smooth and quiet.  The uniqueness of the vehicle sets it apart from all other run-of-the-mill sport utility vehicles.  They are easily accessorized to make yours unique.  Many after market accessories are available.  It is my favorite vehicle on the road.,4.75
436, on 03/11/05 21:07 PM (PST),crazyH2drvr ,2005 HUMMER H2 SUV 4WD 4dr SUV (6.0L 8cyl 4A),I love my H2, I love my H2. Its such a great truck. And let me tell you the attention it gets is way worth it. Fun to drive fun to look at and way worth the money. Gas since its expensive is kinda bad but you know that going into it. Great fun.,4.5
437, on 03/11/05 21:06 PM (PST),lena ,2005 HUMMER H2 SUV 4WD 4dr SUV (6.0L 8cyl 4A),2004 HUMMER, Love it. And yes it is owned by a woman. Gets lots of looks and have only had it in the snow. Looking forward to Taking it on the beaches of the Outer Banks of NC to try it in the sand. Traded a 4Runner in on it which only got 17 miles per gallon so 14 for all this SUVis not bad. Feel very safe in it on all roads and drive it daily,4.625
438, on 02/26/05 11:22 AM (PST),FRANK COLLINS ,2005 HUMMER H2 SUV 4WD 4dr SUV (6.0L 8cyl 4A),Fun to drive vehicle," The 2005 hummer h2 is a very impressive, surprisingly smooth ,fun driving, truck.   When it comes to fuel usage the rating is a little lower,but considering the size of the vehicle and the constant 4-wheel drive you know what to expect before purchasing this particular truck.",4.625
439, on 02/25/05 20:59 PM (PST),Muttseandm ,2005 HUMMER H2 SUV 4WD 4dr SUV (6.0L 8cyl 4A),Wonderful!, The New HUMMER H2 is the most wonderful SUV on Earth (i think so). It is so comfortable. Easy to drive. I have a Black One. LUX Series. Top lights.,5
440, on 02/22/05 11:52 AM (PST),Really own one ,2005 HUMMER H2 SUV 4WD 4dr SUV (6.0L 8cyl 4A),True review by owner," Traded in an 04 Escalade .  The Hummer is a great vehicle .  However a few flaws , windows are very small and restrict visibility .  Does not do too well in mud or ice, tire change would fix . Really fun to drive .  If you add the winch to the front you can not open the hood - on the back can't swing open the tire w/o removing winch .  Ride on highway is great / fair on dirt roads .  4wd is a 10, brakes are a 10 .  All in all I am happy with this vehicle; be sure you can get in and out of it easily. I find it is kinda hard to get in and out, but I am 50 .  The Black leather really shows dirt .  I would buy one again .",4.375
441, on 02/12/05 13:37 PM (PST),bobby ,2005 HUMMER H2 SUV 4WD 4dr SUV (6.0L 8cyl 4A),a must have," i had suvs all my life but nothing will compare to the animal i am driving now.not because its a hummer its because what it dose in all conditions the last northeast blizzard over 2 feet of snow did not stop this truck,or the mountains off roading",4.375
442, on 02/02/05 17:14 PM (PST),shaun laird  ,2005 HUMMER H2 SUV 4WD 4dr SUV (6.0L 8cyl 4A),ABSOLUTLY  Like Nothing Esle," The best thing about the H2 is the wonderful feeling you get not only driving it but starring at it when it sits in front of your house. Now I have had little things that I have had to take to the dealership to have fixed, but the absolute joy of having one overcomes the minor issues   ",5
443, on 01/19/05 13:55 PM (PST),lapointeatlas ,2005 HUMMER H2 SUV 4WD 4dr SUV (6.0L 8cyl 4A),My Hummer, My first long trip happened to be during a snow storm. It was very comforting knowing what I was driving while I was seeing cars and truck sliding off of the Interstate. With the four wheel drive and traction control I never at any time felt like I was not in control,4.25
444, on 01/06/05 01:35 AM (PST),Ayida ,2005 HUMMER H2 SUV 4WD 4dr SUV (6.0L 8cyl 4A),All that & then some....," I wanted this truck since the minute I saw it, but the new color ""Stealth Grey"" sold it! It is an amazing truck, great interior/exterior, I got all the bells and whistles added from the factory, so let's just say it turns some heads, especially from other Hummer owners!  It drives great, a bit hard to park (considering I'm a woman), but it is all that and then some!",4.75
445, on 01/05/05 22:35 PM (PST),aag ,2005 HUMMER H2 SUV 4WD 4dr SUV (6.0L 8cyl 4A),H2 is awesome!," The H2 is very fun to drive, handles well, and makes its own tracks when needed.  Front visibility on the highway is excellent because of height.  Off road, the H2 is a monster and totaly within its element.  Traction and power are awesome.  My H2 has also been very reliable and averages about 11 MPG.  The kids love it, especially the DVD player inserted in the headrests.  Further, the fellow H2 and H1 owners that we have met are a great group to be with during the annual Hummer events.",4.75
446, on 01/05/05 22:22 PM (PST),HF ,2005 HUMMER H2 SUV 4WD 4dr SUV (6.0L 8cyl 4A),Love my H2," This is the most awesome vehicle I have ever driven, It is very comfortable and has a very smooth ride. The best SUV on the market by far.",4.875
447, on 09/25/17 07:46 AM (PDT),bigsherwin ,2003 HUMMER H2 SUV 4WD 4dr SUV (6.0L 8cyl 4A),2003 Hummer H2 aka My BigBoy," I loved this car every since it came out.  I bought a 2003 Hummer and now it has been over 12 years.  I tell everybody that this is the best bad weather vehicle to be driving.  I upgraded the features a few times such as radio, dvd player, rear sensors with camera, gps, etc  I tried to be proactive about maintaining my Hummer and I would say I spent a little $10000 taking with maintenance and repairs over 10 years.  Not bad.  Every year I wonder if I should trade this in, but honestly there is still nothing better than my Hummer.  Sure the gas sucks, but you got to pay to play.   Parking can be a challenge at times but the comfort in driving is still incredible.  And you can't beat that spacious back.  I moved my son in and out of his dorm with no issues getting everything in there.  My BigBoy is getting old and I can feel it, but like I said before there is still nothing else better out there.",4
448, on 04/03/17 21:18 PM (PDT),Rob ,2003 HUMMER H2 SUV 4WD 4dr SUV (6.0L 8cyl 4A),Love MY H2!!!!!! None Better," I have had this Vehicle for 3years Now and I'm loving every time I get in it!  It is a blast to drive hard not to smile when your driving this beast!   The only complaint I have is everything cost so much unless you can do the work yourself,  If you can't do the maitainence and repairs it will cost you...lol  Fuel Pump for example 1000.00 at Chevy Dealership 650.00 at private shop......whoooa  450.00 do it yourself in a day if you know what your doing.  350 for pump/strainer alone...   Gas Mileage is bad but its a HUMMER what do you expect I had a 2003 Ford F-150 5.4 and it was just as bad and I hated driving it.  If you love what you drive it is worth the cash your going to spend on it.  I will drive it into the ground cause I can't even think of anyone else driving MY TANK.....  Get one you won't regret it I won't.  The best thing to happen is when my F-150 got crushed by a tree and I got this awesome SUV. And don't get me started on snow If you have snow and you don't like getting stuck this is the Vehicle for you I have never been stuck and go through blizzards when no one else can.",5
449, on 06/09/16 17:14 PM (PDT),Mike C ,2003 HUMMER H2 SUV 4WD 4dr SUV (6.0L 8cyl 4A),The Best of The Best," Had the car 13 years, never had a major problem. The only problem is the mechanics they break something so they can fix it. Took to the GMC dealer he said I needed 5000 worth of repairs, than got a second opinion at at the triple A garage he fixed it for 175.00. Took it to Firestone to get the air cond charged  they said I needed a whole new air system, 2000. I than took it to the chevy dealer they fixed it for 300.",5
450, on 02/23/16 18:52 PM (PST),Tamiko Coleman ,2003 HUMMER H2 SUV 4WD 4dr SUV (6.0L 8cyl 4A),She's A Beast," I purchased my first H2 over a year and half ago and I will forever own a Hummer!  I am a female cruising around in a black H2 with a chrome package and the attention that this machine get is amazing. Its so funny to watch people when they pull up beside me at a light and they are truly trying to see who is driving this Boss on the road. Especially females! They look as if they are trying to see what guy is driving and they pull up and see it's a girl!!!!!! So funny and everywhere I go men always comment on its uniqueness. I absolutely love my H2. I feel very safe and it is much more comfortable than I could have ever imagined. When I first took it for a test drive I was somewhat intimidated by the size of the vehicle and knew that it would feel bulky. To my surprise it was the smoothest ride and I felt as if I was sitting on my living room couch! Maneuvering the vehicle was mind blowing as well! Changing lanes and turns to me are no different from a car. There is a blind spot but an easy fix! Buy one of the small mirrors that can be placed on the rear view mirrors! Of course the gas mileage is not the greatest but we don't purchase Hummers for fuel efficiency! I am a true H2 fan and when it need to be fed, I am feeding her no matter the cost! Since I've had my truck the only thing I have had to replace is the battery due to my after factory remote car starter and alarm draining it. Other than that I have had no problems! I put synthetic oil in and periodically have the mechanics check for any issues!. I put it on the road from Michigan to Atlanta about 6 months ago and it performed like a trooper and luckily during that time the gas prices dropped dramatically so I was good! I am going to always drive a Hummer because I am completely in love with it's style, comfortability and safety. You just can't go wrong with this Beast!",5
451, on 02/23/16 13:26 PM (PST),Tom Fore ,2003 HUMMER H2 SUV 4WD 4dr SUV (6.0L 8cyl 4A),Very Best vehicle I have ever owned," Rear seating is OK for long trips with heated seats, but people over six foot might be cramped on a long trip.We drove 3685 miles in 5 days to Anchorage AK. Two persons, very comfortable.Average mileage for over 7200 mile round trip was  apx 16 mpg  Average speed was well below posted. Canadian fuel was very expensive by the literCar was 12 years old and there was not a hiccup the whole trip, or after.Be advised that rear suspension airbags must be replaced at 7 to 8 years according to the manual. I changed mine after 12 years of use.",5
