,Review_Date,Author_Name,Vehicle_Title,Review_Title,Review,Rating
84, on 12/03/16 17:35 PM (PST),Andy ,2007 HUMMER H3 SUV 4dr SUV 4WD (3.7L 5cyl 5M),Owned since 2009," Great vehicle that is just at home in the urban crawl as the mountain trail.  Great traction, ride , capability and while not an economy car...I did get 21 mpg on a road trip.   The sunroof is huge and the turning radius is awesome. It looks good, runs good and while it's not an H1 or H2 , it's quite as impressive in a smaller package.",5
85, on 06/02/16 16:59 PM (PDT),Bob M. ,2007 HUMMER H3 SUV 4dr SUV 4WD (3.7L 5cyl 5M),Love my Hummer," This is by far my favorite vehicle that I have owned. Its fun to drive, reliable, and comfortable. I've had Elmo off road in the snow, ice, Mud and sand and never had an issue. I'm constantly looking for a reason to take it off road. We've had it down the beach in Corolla Outer Banks to see the Mustangs. Up the mountain to go hunting and shooting. I can't say anything bad at all. I wish they would start making them again!",5
86, on 03/31/16 17:41 PM (PDT),C Elliott ,2007 HUMMER H3 SUV 4dr SUV 4WD (3.7L 5cyl 5M),My Wrangler is getting JEALOUS..!," I really wasn't in the market for another vehicle, but when my wife kept up how she found the ""perfect"" vehicle for me I went for a look-see.  That said, my Wrangler YJ is sitting outside getting jealous, as I haven't driven it since getting my H3.  Regardless of others reviews, it is a true ""Hummer"" tried and true, just in a slightly smaller package.  Weighing in at 5,885 lbs it has a very solid drive feel, but is extremely nimble when cornering or having to maneuver through traffic.  The exterior draws looks in parking lots and I've had people come up and say, ""I didn't know that they still made these?"".  That's when my pride shows through as I tell them it's a 2007.  On the mechanical side the 5 cyl engine coupled with the 5 speed Automatic gives peppy performance for such a heavy vehicle.  If it had a larger V6, well that would have been nice, but I've had it on the highway up to 85 without any issue.  Mileage is what should be expected for a ""tank"" of an SUV and I go nearly 410 miles on a 23 gal tank, so 16-18 mpg.  With the off road package it has two locked diff settings one 4W Hi / one 4W Lo and take it from me 4W Lo will take you ANYWHERE you dare to go.  Approach and side slope angles are better than the Wrangler as it has a lower center of gravity given the short windows.  Interior comfort is great with deep, contoured seats in front (mine are charcoal/tan bulletproof cloth) and reasonably deep seats in the rear.  Truly, won't use them as ""NO KIDS"" so they will spend time flipped and folded which is a great little feature giving more room to the cargo area.  Overall, I wouldn't trade my H3, unless that is they do start making them here in the USA again.!",5
87, on 10/17/15 13:55 PM (PDT),clyde reed ,2007 HUMMER H3 SUV H3X 4dr SUV 4WD (3.7L 5cyl 5M),my h3, i love this car had it 2 years. the one problum is the check engine light comes on alot. always shows as a miss in the engine. first it was a coil. then fuel injectors. then cant figure it out.,4
88, on 03/03/15 22:40 PM (PST),WayneTonette McCoy ,2007 HUMMER H3 SUV H3X 4dr SUV 4WD (3.7L 5cyl 5M),Love our Hummer," Bought ours a month ago. It's deep maroon  and fully loaded. Like the chrome package and stereo system. Day after we got it drove 3200 miles to Florida and back. Our backs and bottoms didn't hurt at all. It drove and handled great. We stopped to eat and a guy came in asking who owned the hummer. Thought oh no-he backed into it. He wanted to tell me how awesome it looked and if he could look in the windows. Took him out and showed it to him. Two others came over to look at it. At drive up window here the young man said, sir love your hummer. Makes you proud to drive. Great ride.",5
89, on 08/13/13 20:55 PM (PDT),shoragirl ,2007 HUMMER H3 SUV H3X 4dr SUV 4WD (3.7L 5cyl 5M),Love it! But lots of mechanical expenses," I bought my 2007 hummer h3 2 years ago andI honestly love it, however I have spent $4,000 for a transmission rebuild..shocks..2 radiators..water pump..etc. (it's an automatic)It is paid for and I'm keeping it because I really love the style and it's a classy off road SUV!! I just wish it was more reliable!! ",4
90, on 05/02/13 15:40 PM (PDT),nocho1972 ,2007 HUMMER H3 SUV 4dr SUV 4WD (3.7L 5cyl 5M),Blast to drive," I bought my 2007 in 2010 after me and my girlfriend broke up! Nice consolation! This has been a fantastic truck, it's rugged stylish and just an American bad ass truck! I've had a few minor problems, mostly electrical. Drivers window control failed, radiator had to be replaced, all under extended warranty. Over all Great vehicle, will probably be buried in it lol.",4.75
91, on 02/16/12 12:59 PM (PST),craigsdead ,2007 HUMMER H3 SUV 4dr SUV 4WD (3.7L 5cyl 5M),I love my H3,"  I bought my H3 a few months ago, and i love it. All i want to do is drive! It's sleek and rugged at the same time. I believe it will be a collectors car some day. I traded my 07 Mustang GT and have had no regrets. The car was too small, and sucked in the winter.The H3 can drive anywhere. I mean anywhere. It has plenty of room for my wife, kids and dog. It's great to take on long trips. The gas milage isn't great, but it's the same as a lot of the minivans. But it's a Hummer. It's much cooler. Clearly.  If you are thinking about buying an H3, just do it already. You will love it!",5
92, on 11/16/10 00:00 AM (PST),Dale ,2007 HUMMER H3 SUV H3X 4dr SUV 4WD (3.7L 5cyl 5M),I traded my vette for it," I loved my little red '87 Corvette, but when I happened to test drive the H3X, I had no problem trading it in. My Hummer is just as exciting as the vette,just in a different way. I'm safe, comfortable, and still stylish. I can go to the hunting camp and cover it with mud, take it to the car wash and still take the Mrs. to a fancy restaurant that evening. It is the ultimate boy toy. Ladies, there are a lot of H3's coming back on the market from leases at real steals. Christmas is coming. You want to get him something he'll really like?",4.75
93, on 10/19/10 00:00 AM (PDT),PAULICUSMAXIMUS ,2007 HUMMER H3 SUV H3X 4dr SUV 4WD (3.7L 5cyl 5M),Great woods truck, I have owned teo and still have one fuel awful with a average hwy of 15 mpg will go any place you put it. I pulled a 75k tractor trailer without a wheel spin and have the video to back it. You can accessorize to your hearts content. Not made for speed but will go when you have to.,4.125
94, on 09/29/10 00:00 AM (PDT),white h3x ,2007 HUMMER H3 SUV H3X 4dr SUV 4WD (3.7L 5cyl 5M),Hummers rule," This is my 2nd hummer h3. I am now on my 2nd H3 and I have an H3x now and let me tell you this thing is decked out. Tan leather interior, dvd headrest gps Got rid of monsoon system (updated and put new speakers in the doors and even added subwoofers)adding 26s for the warm months next year. I always loved the Hummer line in general and I could not afford the H1 and H2's so the 3 was the best option. I live in Ohio where the winter months has been horrible the last couple of years but my H3 never fails me! I even have friends calling to borrow it or can they pay me to be a taxi for them. Upset GM is taking them away but luckily I have mine already! Will keep for a few years then upgrade to H2",4.875
95, on 04/10/10 10:37 AM (PDT),COL Rhino ,2007 HUMMER H3 SUV H3X 4dr SUV 4WD (3.7L 5cyl 5M),Blizzard Beater," We bought our 07, base, black over black, 5 cylinder engine, auto transmission, H3 Hummer, used with 32,900 miles on it.  This baby is a real blizzard beater.  We bought it during the second blizzard of 2010 in the Washington, DC area. Absolutely a great choice for us.  Nothing stopped it.  Looks great, dependable and runs great too with a comfortable ride, reasonable power for both in-town and highway driving and the Onstar and onboard telephone service is really useful.  We are definitely ready for next winter's snow.  Meanwhile, we are enjoying the Spring and Summer months.  The A/C has kept me cool in unexpected Springtime 96 degree temps, while sitting in rush hour traffic.   Grrrreat!",4.875
96, on 04/09/10 19:47 PM (PDT),robertHummer ,2007 HUMMER H3 SUV 4dr SUV 4WD (3.7L 5cyl 5M),Hate to See  the H3 Go !," After 3 years and 50k miles, the lease is up. Hummer was a trip to own. No major problems . I would say the windows are  too small and going to a ""drive through"" is  torturous. I have to contort myself to get  to the bank teller or McDonald's window. Overall H3  was slightly underpowered. The interior space seamed cramped. I don't think they designed the 07 with BIG PEOPLE in mind. I was uncomfortable . I enjoyed the response of  people who were excited by its  design. Comfort in a car is most important. It is a magnet for  people though. I felt luxury from others but it lacked comfort from its design. I hope they improve.I wish Hummer Well!",3.5
97, on 02/25/10 16:39 PM (PST),Doug R ,2007 HUMMER H3 SUV 4dr SUV 4WD (3.7L 5cyl 5M),HUMMER Family," We liked the 2007 HUMMER so much we bought a second HUMMER in 2009. Now my wife and I each have one to drive. We love the security, safety and comfort of the ride the H3 provides.",5
98, on 01/08/10 16:41 PM (PST),2007 Hummer H3 ,2007 HUMMER H3 SUV 4dr SUV 4WD (3.7L 5cyl 5M),2007 H3 Review," Once you drive one you are hooked it is that simple.  Best 4 x4 I have owned by far.  I have owned Range Rovers, Land Cruisers, Nissans and they are not even close.  There is nothing to dislike about this vehicle.  Sure you hear complaints from other people and manufactures but trust me drive one and you will be hooked like me.  Best off I bought a 2007 with 35k miles for $18k.  ",4.5
99, on 12/24/09 16:51 PM (PST),hummer ,2007 HUMMER H3 SUV H3X 4dr SUV 4WD (3.7L 5cyl 5M),perfect," i just bought my hummer even though it is almost 3 years old i love it.  i bought it with 24,000 miles and i plan on putting a lot of miles on it.  i had a 2004 chevy avalanche and i loved it but i had to trade my beast in for a newer vehicle so i went and drove a yellow H3 and realized it was awesome but i knew yellow would be the wrong color so i went looking for the right one and i found my BLACK with chrome H3 that is just perfect for me i cant wait for the long road trip.  Let me tell you my Wife loves it to.  i plan to add more chrome and in the next few months and this thing will look HOT. ",4.625
100, on 08/06/09 18:59 PM (PDT),Calibrator ,2007 HUMMER H3 SUV 4dr SUV 4WD (3.7L 5cyl 5M),Best 4X4 I've ever owned," I bought our 2007 Hummer H3 used from our Hummer dealer with 22,000 miles.  Black with Black leather interior with chrome accents.  This vehicle turns heads!  Great sound system.  The interior control knows are nice a big (to match the vehicle) and function great.  The sunroof is huge!  I mainly bought this as our alternate vehicle for weekend fun and harsh weather.   I can't wait for snow!  It has an extremely tight turning radius.  It is a pleasure to drive.  It handles well at highway speeds. Fuel economy is okay but on par with other SUV's and minivans!  I've owned Jeeps amd Yukons and this is by far the best of all!  My Jeeps or Yukons never turned heads like this 4X4!  Awesome! ",4.375
101, on 07/28/09 14:59 PM (PDT),hitman ,2007 HUMMER H3 SUV 4dr SUV 4WD (3.7L 5cyl 5M),LOVE my H3!," I've had my H3 for a few yrs now & I love it more & more. I live in Chicago so I have to deal w/horrible winters & the H3 barrels through any obstacles (ice, snow, standing water, etc). I mainly use it for daily commute & while gas mileage isn't that of a Prius, it's on par w/Jeeps, etc. that I've owned in the past. Make sure you get step-tubes b/c the car is pretty hard to get into w/o them. Overall, I love my H3 & definitely recommend it!",4.75
102, on 07/10/09 14:22 PM (PDT),R. OConnor ,2007 HUMMER H3 SUV H3X 4dr SUV 4WD (3.7L 5cyl 5M),"close, but not quite"," We wanted something different than the normal SUV and settled on the Hummer H3.  It is so close to being a good vehicle but it has some drawbacks that would keep me from buying another one.  The engine power is weak, the sideways opening trunk is not practical for towing anything, you can't reach the seat controls on the side unless you open the door, the horn is a joke (you'd be better off rolling the window down and yelling ""excuse me""), and the rear seats don't fold flat.   The monsoon system is awesome though, the height at which you ride is great, it has a surprisingly good turning radius, and the ride is nice.  If GMC could fix the issues identified we would have been thrilled.",2.875
103, on 06/12/09 00:24 AM (PDT),Hummerlover ,2007 HUMMER H3 SUV 4dr SUV 4WD (3.7L 5cyl 5M),Get a Hummer," I bought my H3 used with the luxury and adventure packages. It is black on black with no chrome.. I have always liked the Hummers and when the H3 came out I had to get one. I have a problem spending $42,000 for one so I waited and bought one used. I use my Hummer for my daily driver and my off road adventures. It is fun to drive in town but really comes alive off road! This truck offeres the best of both worlds, luxury for the refined and ruggedness for the adventurous! My H3 is stock and with the adventure package and rear locker, it can go places other stock 4x4's can't.",4.5
104, on 05/31/09 17:22 PM (PDT),Mtnlvr ,2007 HUMMER H3 SUV 4dr SUV 4WD (3.7L 5cyl 5M),I love my Hummer!," Ever since I purchased my Hummer, I feel like I want to live in it! It feels safe, it does have a five star crash rating! It is comfortable to drive, classy and just plain awesome! Even with the bad economy looming over my head, I couldn't resist and purchased the chromed luxury model after one test drive! I drove a Toyota Camry LE as a rental for a week, and believe me that car was horrible. I missed my Hummer really really bad! I could get better gas mileage if I had smaller tires, but I need the clearance. ",4.875
105, on 04/08/09 19:02 PM (PDT),BostonBlackie ,2007 HUMMER H3 SUV 4dr SUV 4WD (3.7L 5cyl 5M),"So far, so very good..."," Always wanted a Hummer, so the H3 was hard to ignore.  Bought my H3 in its limited ""Tactical"" edition which is a base model that features all-black accessories [i.e., brushguard, roof rack, rigid spare tire cover, powder-coated wheel covers, hood grill, sidebars/steps] with no chrome. The interior is a light charcoal. Fortunately, my vehicle came with a factory-installed power sunroof.  When washed, this bad boy shines like a black pearl. Reliability has been great: no recalls to date. Maintenance has been minimal.  The ride and sense of safety are ""like no other.""  Highway mileage has been better that the 2004 Xterra I traded in. ",4.625
106, on 01/17/09 13:11 PM (PST),keith ,2007 HUMMER H3 SUV 4dr SUV 4WD (3.7L 5cyl 5M),Solid performer," I find this vehicle to have adequate power and the off road performance is exceptional. Mine is stock and it is the best off roader I have had. Highway mileage however is not what was advertised. The 20 mpg must have been calculated going downhill. Get 14 in town and 17 on highway. Have a few minor rattles and would like to see less plastic used on interior, cargo room could be improved. Also would like more cubby holes for various items. Overall a good truck",4
107, on 01/02/09 17:24 PM (PST),Boeing777 ,2007 HUMMER H3 SUV 4dr SUV 4WD (3.7L 5cyl 5M),Nothing Else Like It!," I bought limited ""tactical edition,"" which is base black-colored H3 model--equipped with sunroof, brushguard, tire cover, tubular steps, grill, interior trim package, bsw tires, and powder- coated wheels, all colored black.  Understandably, when detailed/washed this vehicle looks sharp, always turning heads.  Fun to drive/ride, especially on longer drives. Handles well: quite reliable in both snow and heavy rains.  Although this vehicle does not get optimal fuel mileage around town, it does much better on highway driving (achieving better highway mileage than my special edition Xterra). Love your H3; it sought out you! ",4.625
108, on 11/24/08 10:05 AM (PST),Beverly Richardson ,2007 HUMMER H3 SUV 4dr SUV 4WD (3.7L 5cyl 5M),Love my H3," My H3 gets 20 mpg on the highway including mountain passes. It gets 15 mpg in town going to and from my work. I love the handling and stability of my H3. It is the Corvette of SUVs. It is comfortable, but I would like softer material in the cloth seats. But I do love the vehicle. ",4.875
109, on 09/22/08 12:49 PM (PDT),kermit ,2007 HUMMER H3 SUV 4dr SUV 4WD (3.7L 5cyl 5M),2007 Hummer H3 better than expected," Having read this review, I assume the author does not drive vehicles off-road. Yes, I agree the paved road performance is not racy, but I related performance for off-road conditions, which is why I bought it. The 12-way heated leather seats are extremely comfortable and there is lots of head room and leg room in the rear seat. Gas mileage improves as it breaks in.  I get 20-21 mpg highway and 17 going to work- half highway (stop-n-go)/half streets.  It is a luxury severe off-road SUV.  It should be compared with Range Rovers not FJ's or Grand Cherokees.",4.625
110, on 08/18/08 23:14 PM (PDT),H3 Tactical Rocks ,2007 HUMMER H3 SUV 4dr SUV 4WD (3.7L 5cyl 5M),"H3 Tactical ""The Anti-Bling!"""," I love my H3 Tactical Edition, it sports NJ Devil colors-Red/Black. I get looks from other H3's with their lame chrome packages, as this one stands out even more than they do with all that chrome. Chrome on a mountain climber? What? Color matching grille and  black brush guard and tube steps and unassuming black stealthy spare tire cover make this the sweetest factory version of all H3's produced and thank God (for me) GM only made 1000 of these! Turning radius is unbelievably tight and bigger 3.7 does just fine on fuel with a nice throaty growl! ",4.375
111, on 08/04/08 12:12 PM (PDT),Beverly ,2007 HUMMER H3 SUV 4dr SUV 4WD (3.7L 5cyl 5M),Love my H3," I love the over-all size of my 2007 H3. The mileage is good (17 MPG in town and 20 MPG mountain driving on the highway).  For the size of this SUV, the H3 handles very well. We live in snow country, so it is a dependable and a sturdy, secure driving vehicle. I like the full time 4x4. The towing package is good; wish we had bought the 2008 with the V8, for more power when towing.  It is a fun vehicle to own.    ",5
112, on 07/13/08 13:29 PM (PDT),Hummer Cody ,2007 HUMMER H3 SUV 4dr SUV 4WD (3.7L 5cyl 5M),Good overall buy," I really like this car. A lot of fun to drive, and pretty reliable.  Wish that it got better gas mileage. I avg 14. Needs a little more power. Don't buy new. The MSRP of mine was $38,000 in Sept of 2006. Trade in on it now $21,500! If this is your daily driver, expect your yearly fuel cost to be around $4,500-5,000!  Make sure you put a lot of money down when you purchase or else you will be upside down later on when you sell it. The new H3 Alpha seems to be better with the V8 engine, but gets worse MPG. Car gets a lot of great looks. The Hummer name impresses people.  ",4.125
113, on 06/07/08 12:46 PM (PDT),Bullwinkle ,2007 HUMMER H3 SUV 4dr SUV 4WD (3.7L 5cyl 5M),No Doubts," Positives: 1) Very comfortable 2) Outstanding steering & suspension 3) Visibility was a concern, but is fine (I am 5'11"") 4)MPG is no worse than any other full-size SUV. I use full synthetic oil, nitrogen in tires, and radial force balance. I get a legit 20MPG if I keep speed no higher than 65 MPH. Contemplating performance intake & exhaust. 4) After rebates & GM supplier discount, it was the same price as many small SUV wannabes. 5) After 8 months and 6,000 miles, it has not been in the shop even once. Needs Improvement: 1) The only area of dissatisfaction is the clunky 5-speed manual. With a smooth-shifting 6-speed manual and 10-20 higher on HP and torque, this would be an awesome machine.",4.25
114, on 04/30/08 14:48 PM (PDT),Valerie ,2007 HUMMER H3 SUV 4dr SUV 4WD (3.7L 5cyl 5M),I love it!," I bought this H3 a year ago because I had a second child and needed a bigger and more reliable car. Even though it is a beautiful SUV, I wasn't sure I was going to enjoy it that much since I previously drove a Corvette. But I absolutely love the Hummer. With the windows being so high, it's also a perfect car to nurse a baby! I have 2 issues with this vehicle though: it is kind of slow (you would expect a bigger engine)& there is no visibility through the back window. When a car is behind you, all you see is the roof, it makes it hard to back up. I notice also that the pedals are very close together just like the Corvette. All in all, it is a great vehicle, I haven't had any problems with it.",4.625
115, on 03/09/08 20:54 PM (PDT),MLW ,2007 HUMMER H3 SUV 4dr SUV 4WD (3.7L 5cyl 5M),Great present!," I got my 2007 H3 in May of 2007, as a gift from my parents, for my high school graduation. I started following the H3 when they were introduced in 2005, and wanted one right away. It pulls my boat fine, but I sort of wish I would have waited and got the Alpha, as the 5 cyl. don't have the juice that a 5,000 lb. vehicle needs.  (especially going from a 3/4 ton Silverado, to this)  I will probably get an H2 next for the additional pulling power and room. Overall though, this is a wonderful vehicle and is an absolute joy to drive, all for under $40,000.",4.625
116, on 03/05/08 13:34 PM (PST),duceii ,2007 HUMMER H3 SUV 4dr SUV 4WD (3.7L 5cyl 5M),6 months of fun, I got the Lux edition and I love it.  Found out I needed to add mud flaps right after the first snow.  Also figure on going through at least one windsheild per year from stone chips and the severe angle of it.  These small issues are nothing compared to the headaches I have had dealing with over seas manufactures.  Gas mileage could be better but it is still better than the Jeep I used to have and this is much more versatile.  For the money this truck can't be beat!,4.875
117, on 02/03/08 21:56 PM (PST),J75 ,2007 HUMMER H3 SUV 4dr SUV 4WD (3.7L 5cyl 5M),H3 Tactical Edition," Overall, enjoy my H3! Drove a 2006 F- 150 supercrew before this, saw the H3 Tactical, and fell in love with the aggressive black on black exterior. Only negative would be, had some transmission problems at 3,300 miles. Apparently had faulty parts and installation. Still worry about a brand new vehicle with that kind of problem! Dealership did a excellent job with repair and outstanding customer service. I always hear about how small H3's are compared to H2's! Want to thank the haters for stating the obvious, that's exactly why I purchased the H3! Recommend this vehicle to anyone!",4.625
118, on 01/22/08 05:19 AM (PST),engineer ,2007 HUMMER H3 SUV 4dr SUV 4WD (3.7L 5cyl 5M),A real Let Down," Bought this brand new 5 months ago... injector issues,misfires,horrible fuel economy with only 5k miles. The vehicle averages 11MPG city and 14MPG hwy. The ride quality is nice. The interior room is poor... even with the back seats folded down, there is no usable space. The 5 cyl engine is always straining to keep it moving and not having a 2wd only option eats the front tires. This vehicle has no tow abilities and with the spare tire mounted in the middle of the rear makes it tough to see out the rear window. Overall, I wish I had kept my Yukon.",2.5
119, on 01/17/08 21:15 PM (PST),Blacksmith ,2007 HUMMER H3 SUV 4dr SUV 4WD (3.7L 5cyl 5M),H3 Rules!," My '04 Grand Cherokee was making a lot of engine noise so I thought I'd go test drive a few. They had H3 base model on the lot at a blow out price. I really didn't want stick, but when I drove it, I fell in love. Big thick steering wheel and big shift knob. I'm 6-4 and this is hands down the most comfortable vehicle for a tall guy weighing 260. I don't even have to put the seat all the way back!  The stick is easy to drive, the engine has good low end torque. Even the sound of the Atlas 5 is great. The shifter is kind of stiff and there is some small noises in it I'm monitoring with the service guys. It's still pretty new so I have just put in 4 wheel drive low/lock briefly in the dirt. ",5
120, on 12/08/07 06:42 AM (PST),Walker ,2007 HUMMER H3 SUV 4dr SUV 4WD (3.7L 5cyl 5M),Hummer Baby!," We love our H3. We've put it through its paces on the highway as well as off road (snow, ice, sand, shale, boulders, steep inclines, etc.) ... excellent performance. My wife and daughter love this car,they used to have an Audi A6 Avant. This car has so much more utility and the fun factor is way through the roof.",4.625
121, on 12/07/07 08:06 AM (PST),Charlie ,2007 HUMMER H3 SUV H3X 4dr SUV 4WD (3.7L 5cyl 5M),Hummer H3x ," Takes a little getting used to. Not the best visability. I don't like the way it downshifts at aroung 38 mph. The ride is smooth and it shifts nice.It gets 16 1/2 - 17 1/2 depending on if my wife is driving. Between the read doors it collects dirt,I installed mud flaps and body trim, didn't work. OnStar system was best investment as my wife likes the security. Overall I like, would consider another.",4
122, on 10/27/07 12:18 PM (PDT),jona matthews ,2007 HUMMER H3 SUV H3X 4dr SUV 4WD (3.7L 5cyl 5M),The Hummer is the bomb!," I bought my Hummer 2 weeks ago, and I absolutely love it! It drives well. It is comfortable. ",4.875
123, on 10/24/07 16:37 PM (PDT),"Webb, I. ",2007 HUMMER H3 SUV 4dr SUV 4WD (3.7L 5cyl 5M),"Hummer, Nothing Else", I have had my H3 for a few months now and I love it. The performance to me is good enough for the gas mileage that I get. I drive hundreds of mile a week on the highway and it is great. I love it when everyone else just moves over out of my way. I get numerous compliment on my H3 and it is still stock. I am proud of my Hummer H3 and that is just the way it is.,5
